title,link,keyword,state
¡Desalmados! Niega hotel entrada a mujer invidente por su perro guía,https://laopcion.com.mx/nacional/desalmados-niega-hotel-entrada-a-mujer-invidente-por-su-perro-guia-20241218-480217.html,mujer,chih
Ejecutan a mujer frente a sus hijos en Tierra y Libertad,https://laopcion.com.mx/local/ejecutan-a-mujer-frente-a-sus-hijos-en-tierra-y-libertad-20241212-479729.html,mujer,chih
Lo detienen en Misiones del Real por golpear a una mujer,https://laopcion.com.mx/juarez/lo-detienen-en-misiones-del-real-por-golpear-a-una-mujer-20241214-479914.html,mujer,chih
Brinda Paty Ulate plática sobre violencia contra la mujer,https://laopcion.com.mx/local/brinda-paty-ulate-platica-sobre-violencia-contra-la-mujer-20241127-478711.html,mujer,chih
Capacitan en diversos cursos de empoderamiento a la mujer,https://laopcion.com.mx/local/capacitan-en-diversos-cursos-de-empoderamiento-a-la-mujer-20240919-473231.html,mujer,chih
Lanza Alcalde podcast en contra de la violencia hacia la mujer,https://laopcion.com.mx/local/lanza-alcalde-podcast-en-contra-de-la-violencia-hacia-la-mujer-20241125-478541.html,mujer,chih
PT hace llamado a disminuir violencia contra la mujer,https://laopcion.com.mx/juarez/pt-hace-llamado-a-disminuir-violencia-contra-la-mujer-20241125-478536.html,mujer,chih
Publican decreto constitucional para la igualdad de la mujer,https://laopcion.com.mx/juarez/publican-decreto-constitucional-para-la-igualdad-de-la-mujer-20241115-477809.html,mujer,chih
Conmemoran en el Congreso el Día Internacional de la Mujer ...,https://laopcion.com.mx/local/conmemoran-en-el-congreso-el-dia-internacional-de-la-mujer-indigena-20240913-472767.html,mujer,chih
Ganan tres meoquenses el Premio a la Mujer Rural,https://laopcion.com.mx/delicias/ganan-tres-meoquenses-el-premio-a-la-mujer-rural-20241030-476485.html,mujer,chih
Celebra Mujer con Valor una década empoderando a las mujeres,https://laopcion.com.mx/local/celebra-mujer-con-valor-una-decada-empoderando-a-las-mujeres-20240510-462877.html,mujer,chih
Mujer roba con violencia tienda en la colonia México 68,https://laopcion.com.mx/juarez/mujer-roba-con-violencia-tienda-en-la-colonia-mexico-68-20241217-480125.html,mujer,chih
Invitan a participar en la convocatoria Mujer Rural 2024,https://laopcion.com.mx/local/invitan-a-participar-en-la-convocatoria-mujer-rural-2024-20240823-471096.html,mujer,chih
Balean a mujer en la colonia Vistas de San Guillermo,https://laopcion.com.mx/local/balean-a-mujer-en-la-colonia-vistas-de-san-guillermo-20241208-479461.html,mujer,chih
Sancionar el aborto forzado es clave para proteger a la mujer,https://laopcion.com.mx/local/sancionar-el-aborto-forzado-es-clave-para-proteger-a-la-mujer-20240805-469614.html,mujer,chih
Piden ayuda para localizar a mujer que olvidó cartera,https://laopcion.com.mx/delicias/piden-ayuda-para-localizar-a-mujer-que-olvido-cartera-20241028-476334.html,mujer,chih
Imparten taller de empoderamiento de la mujer,https://laopcion.com.mx/local/imparten-taller-de-empoderamiento-de-la-mujer-20170311-169490.html,mujer,chih
Recibirá del presupuesto 11 mdp el Instituto municipal de la mujer,https://laopcion.com.mx/local/recibira-del-presupuesto-11-mdp-el-instituto-municipal-de-la-mujer-20161227-162471.html,mujer,chih
Analizan iniciativas para Trabajadores del Campo y la Mujer Rural,https://laopcion.com.mx/local/analizan-iniciativas-para-trabajadores-del-campo-y-la-mujer-rural-20241025-476134.html,mujer,chih
Encuentran con vida a mujer desaparecida en noviembre de 2023,https://laopcion.com.mx/local/encuentran-con-vida-a-mujer-desaparecida-en-noviembre-de-2023-20240110-451724.html,mujer,chih
Hoy se celebra el Día de la Mujer Mexicana | La Opción de Chihuahua,https://laopcion.com.mx/nacional/hoy-se-celebra-el-dia-de-la-mujer-mexicana-20170215-167303.html,mujer,chih
FGE solicita colaboración para identificar a mujer localizada sin vida,https://laopcion.com.mx/policial/fge-solicita-colaboracion-para-identificar-a-mujer-localizada-sin-vida-20220909-400054.html,mujer,chih
Imparten conferencia sobre rol de la mujer a alumnos de secundaria,https://laopcion.com.mx/noticias/imparten-conferencia-sobre-rol-de-la-mujer-a-alumnos-de-secundaria-20140330-33702.html,mujer,chih
Solicitan ayuda para identificar el cadáver de una mujer encontrada ...,https://laopcion.com.mx/juarez/solicitan-ayuda-para-identificar-el-cadaver-de-una-mujer-encontrada-en-zaragoza-20241205-479299.html,mujer,chih
Autorizan Reglamento del Instituto Municipal de la Mujer,https://laopcion.com.mx/noticias/autorizan-reglamento-del-instituto-municipal-de-la-mujer-20140404-34490.html,mujer,chih
Pide Fiscalía de Género ayuda para identificar a mujer localizada ...,https://laopcion.com.mx/juarez/pide-fiscalia-de-genero-ayuda-para-identificar-a-mujer-localizada-sin-vida-20230223-418215.html,mujer,chih
Realizan plática en albergue de migrantes sobre la violencia contra ...,https://laopcion.com.mx/juarez/realizan-platica-en-albergue-de-migrantes-sobre-la-violencia-contra-la-mujer-20240807-469843.html,mujer,chih
Coloca Onmpri manta para eliminar la violencia contra la mujer,https://laopcion.com.mx/local/coloca-onmpri-manta-para-eliminar-la-violencia-contra-la-mujer-20151125-115245.html,mujer,chih
Invita presidenta del DIF municipal a conferencia La Mujer como ...,https://laopcion.com.mx/local/invita-presidenta-del-dif-municipal-a-conferencia-la-mujer-como-factor-de-cambio-20141126-70754.html,mujer,chih
Arrollan a mujer y la hospitalizan - La Opción de Chihuahua,https://www.laopcion.com.mx/delicias/arrollan-a-mujer-y-la-hospitalizan-20210619-337124.html,mujer,chih
Imparten conferencia Magistral sobre participación política de la mujer,https://laopcion.com.mx/local/imparten-conferencia-magistral-sobre-participacion-politica-de-la-mujer-20140328-33538.html,mujer,chih
Atropella Vivebús a mujer y la deja con severas lesiones,https://laopcion.com.mx/noticias/atropella-vivebus-a-mujer-y-la-deja-con-severas-lesiones-20140409-35170.html,mujer,chih
Conmemoran el Día de la Mujer Rural en el Congreso,https://laopcion.com.mx/local/conmemoran-el-dia-de-la-mujer-rural-en-el-congreso-20241015-475345.html,mujer,chih
Vinculan a proceso a mujer por violencia familiar,https://laopcion.com.mx/juarez/vinculan-a-proceso-a-mujer-por-violencia-familiar-20240203-453972.html,mujer,chih
Muere un hombre y queda lesionada una mujer en ataque armado,https://laopcion.com.mx/local/muere-un-hombre-y-queda-lesionada-una-mujer-en-ataque-armado-20241213-479874.html,mujer,chih
Fortalece en NCG Fiscalía de la Mujer acciones contra violencia de ...,https://laopcion.com.mx/nuevo-casas-grandes/fortalece-en-ncg-fiscalia-de-la-mujer-acciones-contra-violencia-de-genero-y-familiar-wendy-chavez-20231005-442365.html,mujer,chih
Se indigna mujer porque hombre le pide pagar la mitad de la cuenta,https://www.laopcion.com.mx/viral/se-indigna-mujer-porque-hombre-le-pide-pagar-la-mitad-de-la-cuenta-20240908-472358.html,mujer,chih
"Ofrece Mujer con valor, atención a menores que han sufrido abuso ...",https://laopcion.com.mx/local/ofrece-mujer-con-valor-atencion-a-menores-que-han-sufrido-abuso-sexual-20240507-462650.html,mujer,chih
El apoyo a la mujer es fundamental para el desarrollo del estado,https://laopcion.com.mx/amp/nacional/el-apoyo-a-la-mujer-es-fundamental-para-el-desarrollo-del-estado-alex-dominguez-20160308-127870.html,mujer,chih
Comisión Local de Búsqueda se suma a ... - La Opción de Chihuahua,https://laopcion.com.mx/policial/comision-local-de-busqueda-se-suma-a-la-busqueda-de-mujer-desaparecida-20230720-433457.html,mujer,chih
Piden apoyo para localizar a familiares de mujer extraviada,https://laopcion.com.mx/noticias/piden-apoyo-para-localizar-a-familiares-de-mujer-extraviada-20170104-163277.html,mujer,chih
Ofrece PAN Municipal conferencias por día de la Mujer,https://laopcion.com.mx/local/ofrece-pan-municipal-conferencias-por-dia-de-la-mujer-20140308-30592.html,mujer,chih
Atropellan a mujer en periférico de Parral - La Opción de Chihuahua,https://laopcion.com.mx/noticias/atropellan-a-mujer-en-periferico-de-parral-20161118-158358.html,mujer,chih
Lesionan a mujer embarazada en Riveras del Valle,https://laopcion.com.mx/juarez/lesionan-a-mujer-embarazada-en-riveras-del-valle-20241218-480221.html,mujer,chih
Realizan primer conservatorio Binacional sobre la mujer de México,https://laopcion.com.mx/nacional/realizan-primer-conservatorio-binacional-sobre-la-mujer-de-mexico-20160202-123159.html,mujer,chih
Presenta Yesenia Reyes iniciativa para declarar el Día Estatal de la ...,https://laopcion.com.mx/local/presenta-yesenia-reyes-iniciativa-para-declarar-el-dia-estatal-de-la-mujer-rural-20241015-475365.html,mujer,chih
Piden apoyo para hallar a familiares de mujer extraviada,https://laopcion.com.mx/noticias/piden-apoyo-para-hallar-a-familiares-de-mujer-extraviada-20170703-179640.html,mujer,chih
En reunión de la Comisión de la Mujer y Equidad de Género ...,https://laopcion.com.mx/juarez/en-reunion-de-la-comision-de-la-mujer-y-equidad-de-genero-presentan-el-libro-reflexiones-sobre-la-accion-publica-20230417-424126.html,mujer,chih
Promueve Desarrollo Urbano lucha contra violencia hacia la mujer,https://laopcion.com.mx/local/promueve-desarrollo-urbano-lucha-contra-violencia-hacia-la-mujer-20141125-70644.html,mujer,chih
Mujer migrante da a luz a niña en Juárez - La Opción de Chihuahua,https://laopcion.com.mx/juarez/mujer-migrante-da-a-luz-a-nina-en-juarez-20240511-462964.html,mujer,chih
Encuentran a mujer sin vida en carretera a majalca,https://www.laopcion.com.mx/policial/encuentran-a-mujer-sin-vida-en-carretera-a-majalca-20210123-305522.html,mujer,chih
Formulan cargos contra feminicida de mujer en Las Industrias,https://laopcion.com.mx/policial/formulan-cargos-contra-feminicida-de-mujer-en-las-industrias-20230802-434768.html,mujer,chih
Rescatan a mujer atrapada en un elevador de la Secretaría del ...,https://laopcion.com.mx/local/rescatan-a-mujer-atrapada-en-un-elevador-de-la-secretaria-del-trabajo-20240808-469884.html,mujer,chih
Entregarán reconocimiento a Mujer Distinguida en Delicias,https://laopcion.com.mx/noticias/entregaran-reconocimiento-a-mujer-distinguida-en-delicias-20160204-123515.html,mujer,chih
Mujer intenta lanzarse de puente en Avenida de las Torres,https://laopcion.com.mx/juarez/mujer-intenta-lanzarse-de-puente-en-avenida-de-las-torres-20241007-474660.html,mujer,chih
Identifican restos de mujer encontrados cerca del Cristo Negro,https://laopcion.com.mx/noticias/identifican-restos-de-mujer-encontrados-cerca-del-cristo-negro-20130805-785.html,mujer,chih
Muere mujer al volcar en la rúa de Delicias a Chihuahua,https://laopcion.com.mx/local/muere-mujer-al-volcar-en-la-rua-de-delicias-a-chihuahua-20241123-478394.html,mujer,chih
No debemos permanecer ajenos a la violencia contra la mujer,https://laopcion.com.mx/local/no-debemos-permanecer-ajenos-a-la-violencia-contra-la-mujer-teporaca-20140910-59854.html,mujer,chih
Atropellan a mujer en ciudad Aldama | La Opción de Chihuahua,https://www.laopcion.com.mx/local/atropellan-a-mujer-en-ciudad-aldama-20240901-471736.html,mujer,chih
Se realizará el cabildo de mujeres este martes,https://laopcion.com.mx/parral/se-realizara-el-cabildo-de-mujeres-este-martes-20220307-377247.html,mujer,chih
Rescatan a mujer embarazada que intento quitarse la vida,https://laopcion.com.mx/juarez/rescatan-a-mujer-embarazada-que-intento-quitarse-la-vida-20240819-470763.html,mujer,chih
Captan rescate de mujer que se tiró de un puente y fue tomada del ...,https://laopcion.com.mx/nacional/captan-rescate-de-mujer-que-se-tiro-de-un-puente-y-fue-tomada-del-cabello-20240818-470694.html,mujer,chih
Muere mujer y se lesionan cuatro al volcar en la rúa a Villa ...,https://laopcion.com.mx/noticias/muere-mujer-y-se-lesionan-cuatro-al-volcar-en-la-rua-a-villa-ahumadajuarez-20150916-107584.html,mujer,chih
Fortalecerán Fiscalía de la Mujer con personal suficiente y capacitado,https://laopcion.com.mx/nuevo-casas-grandes/fortaleceran-fiscalia-de-la-mujer-con-personal-suficiente-y-capacitado-20231211-449356.html,mujer,chih
Alista iglesia católica marcha a favor de la mujer y la vida,https://laopcion.com.mx/local/alista-iglesia-catolica-marcha-a-favor-de-la-mujer-y-la-vida-20210925-351627.html,mujer,chih
Realizará justicia para nuestras hijas actividades vs violencia contra ...,https://laopcion.com.mx/local/realizara-justicia-para-nuestras-hijas-actividades-vs-violencia-contra-la-mujer-20211022-356157.html,mujer,chih
Rescatan a mujer tras fuga de gas en la colonia Nacional,https://laopcion.com.mx/local/rescatan-a-mujer-tras-fuga-de-gasen-la-colonia-nacional-20240805-469627.html,mujer,chih
Cada 10 minutos una mujer es asesinada a manos de su pareja o ...,https://laopcion.com.mx/nacional/cada-10-minutos-una-mujer-es-asesinada-a-manos-de-su-pareja-o-un-familiar-onu-20241125-478480.html,mujer,chih
Mujer ebria choca contra muro de contención en el Canal,https://laopcion.com.mx/policial/mujer-ebria-choca-contra-muro-de-contencion-en-el-canal-20141207-72338.html,mujer,chih
Solicitan apoyo para identificar a mujer que dejaron en tiradero ...,https://laopcion.com.mx/juarez/solicitan-apoyo-para-identificar-a-mujer-que-dejaron-en-tiradero-clandestino-20240826-471315.html,mujer,chih
Vuelca mujer en curvas de la 20 de noviembre,https://laopcion.com.mx/local/vuelca-mujer-en-curvas-de-la-20-de-noviembre-20241031-476615.html,mujer,chih
Inauguran exposición fotográfica Grito de Mujer en congreso del ...,https://laopcion.com.mx/local/inauguran-exposicion-fotografica-grito-de-mujer-en-congreso-del-estado-20230303-419053.html,mujer,chih
Hallan muerta a mujer en chihuahua 2000,https://laopcion.com.mx/policial/hallan-muerta-a-mujer-en-chihuahua-2000-20200710-276303.html,mujer,chih
Conmemora Immujeres Día de la Eliminación de la Violencia vs la ...,https://laopcion.com.mx/amp/local/conmemora-immujeres-dia-de-la-eliminacion-de-la-violencia-vs-la-mujer-con-dianaranja-20140525-42033.html,mujer,chih
Inicia Universidad Tecnológica jornadas por Día de la Mujer,https://laopcion.com.mx/juarez/inicia-universidad-tecnologica-jornadas-por-dia-de-la-mujer-20240305-456802.html,mujer,chih
Colaboran Municipio y FGE para combatir violencia contra mujeres,https://laopcion.com.mx/local/colaboran-municipio-y-fge-para-combatir-violencia-contra-mujeres-20241214-479920.html,mujer,chih
Asisten estatales a mujer en labor de parto en la calle,https://laopcion.com.mx/local/asisten-estatales-a-mujer-en-labor-de-parto-en-la-calle-20240901-471739.html,mujer,chih
Realiza Ivon Salazar recital poético en pro de la mujer,https://laopcion.com.mx/local/realiza-ivon-salazar-recital-poetico-en-pro-de-la-mujer-20221124-409136.html,mujer,chih
Premia municipio a mujeres distinguidas de Delicias,https://laopcion.com.mx/noticias/premia-municipio-a-mujeres-distinguidas-de-delicias-20140308-30636.html,mujer,chih
Finaliza jornada de actividades día internacional de la mujer en ...,https://laopcion.com.mx/local/finaliza-jornada-de-actividades-dia-internacional-de-la-mujer-en-canaco-20210309-314361.html,mujer,chih
Conmemoran panistas el Día internacional de la mujer,https://laopcion.com.mx/local/conmemoran-panistas-el-dia-internacional-de-la-mujer-20140308-30651.html,mujer,chih
Detienen a mujer de 28 años por agredir a su mamá,https://laopcion.com.mx/juarez/detienen-a-mujer-de-28-anos-por-agredir-a-su-mama-20241214-479912.html,mujer,chih
Mujer pierde una pierna al ser aplastada por el tren,https://laopcion.com.mx/juarez/mujer-pierde-una-pierna-al-ser-aplastada-por-el-tren-20240915-472899.html,mujer,chih
Video: Mujer lanza licuado a empleada de tienda,https://laopcion.com.mx/nacional/video-mujer-lanza-licuado-a-empleada-de-tienda-20210106-302904.html,mujer,chih
Asisten estatales a mujer en labor de parto en la calle,https://laopcion.com.mx/local/asisten-estatales-a-mujer-en-labor-de-parto-en-la-calle-20240901-471739.html,mujer,chih
Abordan retos en la participación política de la mujer,https://laopcion.com.mx/juarez/abordan-retos-en-la-participacion-politica-de-la-mujer-20221003-403229.html,mujer,chih
Presenta el Instituto de la Mujer libro sobre su historia,https://laopcion.com.mx/local/presenta-el-instituto-de-la-mujer-libro-sobre-su-historia-20150317-85785.html,mujer,chih
Muere mujer al caer a canal; menor resulta herido,https://laopcion.com.mx/local/muere-mujer-al-caer-a-canal-menor-resulta-herido-20241127-478720.html,mujer,chih
Mujer se arroja de puente en la Francisco Villarreal,https://laopcion.com.mx/juarez/mujer-se-arroja-de-puente-en-la-francisco-villarreal-20241116-477876.html,mujer,chih
Conoce el trabajo del Instituto Chihuahuense de la Mujer,https://laopcion.com.mx/local/conoce-el-trabajo-del-instituto-chihuahuense-de-la-mujer-20140331-33823.html,mujer,chih
CNDH señala a la GN por la muerte de una mujer embarazada,https://laopcion.com.mx/nacional/cndh-senala-a-la-gn-por-la-muerte-de-una-mujer-embarazada-20221011-404184.html,mujer,chih
Piden encontrar a mujer desaparecida desde el 2008,https://laopcion.com.mx/policial/piden-encontrar-a-mujer-desaparecida-desde-el-2008-20210407-320702.html,mujer,chih
Es Juarense la primer mujer del Estado en llevar un proyecto con la ...,https://laopcion.com.mx/juarez/es-juarense-la-primer-mujer-del-estado-en-llevar-un-proyecto-con-la-nasa-20241108-477251.html,mujer,chih
Abre paso rol de la mujer chihuahuense en la minería,https://laopcion.com.mx/local/abre-paso-rol-de-la-mujer-chihuahuense-en-la-mineria-20220111-369008.html,mujer,chih
Atienden síndromes en mujeres en situación de violencia,https://laopcion.com.mx/amp/local/atienden-sindromes-en-mujeres-en-situacion-de-violencia-20150209-81048.html,mujer,chih
Vinculan a proceso a masculino por agredir a mujer embarazada,https://laopcion.com.mx/nuevo-casas-grandes/vinculan-a-proceso-a-masculino-por-agredir-a-mujer-embarazada-20231201-448475.html,mujer,chih
Arrolla camión del Bowi a mujer y queda herida de gravedad,https://laopcion.com.mx/local/arrolla-camion-del-bowi-a-mujer-y-queda-herida-de-gravedad-20240412-460397.html,mujer,chih
Resulta mujer herida al ser arrollada en el Ortiz Mena,https://laopcion.com.mx/local/resulta-mujer-herida-al-ser-arrollada-en-el-ortiz-mena-20240913-472823.html,mujer,chih
Hallan mujer muerta en casa de los frailes - La Opción de Chihuahua,https://laopcion.com.mx/policial/hallan-mujer-muerta-en-casa-de-los-frailes-20200710-276293.html,mujer,chih
Identifican al ejecutado y a mujer herida en Santo Niño,https://laopcion.com.mx/local/identifican-al-ejecutado-y-a-mujer-herida-en-santo-nino-20241214-479910.html,mujer,chih
